sunt aut facere repellat provident occaecati excepturi optio reprehenderit, quia et suscipit
suscipit recusandae consequuntur expedita et cum
reprehenderit molestiae ut ut quas totam
nostrum rerum est autem sunt rem eveniet architectoqui est esse, est rerum tempore vitae
sequi sint nihil reprehenderit dolor beatae ea dolores neque
fugiat blanditiis voluptate porro vel nihil molestiae ut reiciendis
qui aperiam non debitis possimus qui neque nisi nullaea molestias quasi exercitationem repellat qui ipsa sit aut, et iusto sed quo iure
voluptatem occaecati omnis eligendi aut ad
voluptatem doloribus vel accusantium quis pariatur
molestiae porro eius odio et labore et velit auteum et est occaecati, ullam et saepe reiciendis voluptatem adipisci
sit amet autem assumenda provident rerum culpa
quis hic commodi nesciunt rem tenetur doloremque ipsam iure
quis sunt voluptatem rerum illo velitnesciunt quas odio, repudiandae veniam quaerat sunt sed
alias aut fugiat sit autem sed est
voluptatem omnis possimus esse voluptatibus quis
est aut tenetur dolor nequedolorem eum magni eos aperiam quia, ut aspernatur corporis harum nihil quis provident sequi
mollitia nobis aliquid molestiae
perspiciatis et ea nemo ab reprehenderit accusantium quas
voluptate dolores velit et doloremque molestiaemagnam facilis autem, dolore placeat quibusdam ea quo vitae
magni quis enim qui quis quo nemo aut saepe
quidem repellat excepturi ut quia
sunt ut sequi eos ea sed quasdolorem dolore est ipsam, dignissimos aperiam dolorem qui eum
facilis quibusdam animi sint suscipit qui sint possimus cum
quaerat magni maiores excepturi
ipsam ut commodi dolor voluptatum modi aut vitaenesciunt iure omnis dolorem tempora et accusantium, consectetur animi nesciunt iure dolore
enim quia ad
veniam autem ut quam aut nobis
et est aut quod aut provident voluptas autem voluptasoptio molestias id quia eum, quo et expedita modi cum officia vel magni
doloribus qui repudiandae
vero nisi sit
quos veniam quod sed accusamus veritatis erroret ea vero quia laudantium autem, delectus reiciendis molestiae occaecati non minima eveniet qui voluptatibus
accusamus in eum beatae sit
vel qui neque voluptates ut commodi qui incidunt
ut animi commodiin quibusdam tempore odit est dolorem, itaque id aut magnam
praesentium quia et ea odit et ea voluptas et
sapiente quia nihil amet occaecati quia id voluptatem
incidunt ea est distinctio odiodolorum ut in voluptas mollitia et saepe quo animi, aut dicta possimus sint mollitia voluptas commodi quo doloremque
iste corrupti reiciendis voluptatem eius rerum
sit cumque quod eligendi laborum minima
perferendis recusandae assumenda consectetur porro architecto ipsum ipsamvoluptatem eligendi optio, fuga et accusamus dolorum perferendis illo voluptas
non doloremque neque facere
ad qui dolorum molestiae beatae
sed aut voluptas totam sit illumeveniet quod temporibus, reprehenderit quos placeat
velit minima officia dolores impedit repudiandae molestiae nam
voluptas recusandae quis delectus
officiis harum fugiat vitaesint suscipit perspiciatis velit dolorum rerum ipsa laboriosam odio, suscipit nam nisi quo aperiam aut
asperiores eos fugit maiores voluptatibus quia
voluptatem quis ullam qui in alias quia est
consequatur magni mollitia accusamus ea nisi voluptate dictafugit voluptas sed molestias voluptatem provident, eos voluptas et aut odit natus earum
aspernatur fuga molestiae ullam
deserunt ratione qui eos
qui nihil ratione nemo velit ut aut id quovoluptate et itaque vero tempora molestiae, eveniet quo quis
laborum totam consequatur non dolor
ut et est repudiandae
est voluptatem vel debitis et magnamadipisci placeat illum aut reiciendis qui, illum quis cupiditate provident sit magnam
ea sed aut omnis
veniam maiores ullam consequatur atque
adipisci quo iste expedita sit quos voluptasdoloribus ad provident suscipit at, qui consequuntur ducimus possimus quisquam amet similique
suscipit porro ipsam amet
eos veritatis officiis exercitationem vel fugit aut necessitatibus totam
omnis rerum consequatur expedita quidem cumque explicaboasperiores ea ipsam voluptatibus modi minima quia sint, repellat aliquid praesentium dolorem quo
sed totam minus non itaque
nihil labore molestiae sunt dolor eveniet hic recusandae veniam
tempora et tenetur expedita suntdolor sint quo a velit explicabo quia nam, eos qui et ipsum ipsam suscipit aut
sed omnis non odio
expedita earum mollitia molestiae aut atque rem suscipit
nam impedit essemaxime id vitae nihil numquam, veritatis unde neque eligendi
quae quod architecto quo neque vitae
est illo sit tempora doloremque fugit quod
et et vel beatae sequi ullam sed tenetur perspiciatisautem hic labore sunt dolores incidunt, enim et ex nulla
omnis voluptas quia qui
voluptatem consequatur numquam aliquam sunt
totam recusandae id dignissimos aut sed asperiores deseruntrem alias distinctio quo quis, ullam consequatur ut
omnis quis sit vel consequuntur
ipsa eligendi ipsum molestiae et omnis error nostrum
molestiae illo tempore quia et distinctioest et quae odit qui non, similique esse doloribus nihil accusamus
omnis dolorem fuga consequuntur reprehenderit fugit recusandae temporibus
perspiciatis cum ut laudantium
omnis aut molestiae vel veroquasi id et eos tenetur aut quo autem, eum sed dolores ipsam sint possimus debitis occaecati
debitis qui qui et
ut placeat enim earum aut odit facilis
consequatur suscipit necessitatibus rerum sed inventore temporibus consequaturdelectus ullam et corporis nulla voluptas sequi, non et quaerat ex quae ad maiores
maiores recusandae totam aut blanditiis mollitia quas illo
ut voluptatibus voluptatem
similique nostrum eumiusto eius quod necessitatibus culpa ea, odit magnam ut saepe sed non qui
tempora atque nihil
accusamus illum doloribus illo dolor
eligendi repudiandae odit magni similique sed cum maioresa quo magni similique perferendis, alias dolor cumque
impedit blanditiis non eveniet odio maxime
blanditiis amet eius quis tempora quia autem rem
a provident perspiciatis quiaullam ut quidem id aut vel consequuntur, debitis eius sed quibusdam non quis consectetur vitae
impedit ut qui consequatur sed aut in
quidem sit nostrum et maiores adipisci atque
quaerat voluptatem adipisci repudiandaedoloremque illum aliquid sunt, deserunt eos nobis asperiores et hic
est debitis repellat molestiae optio
nihil ratione ut eos beatae quibusdam distinctio maiores
earum voluptates et aut adipisci ea maiores voluptas maximequi explicabo molestiae dolorem, rerum ut et numquam laborum odit est sit
id qui sint in
quasi tenetur tempore aperiam et quaerat qui in
rerum officiis sequi cumque quodmagnam ut rerum iure, ea velit perferendis earum ut voluptatem voluptate itaque iusto
totam pariatur in
nemo voluptatem voluptatem autem magni tempora minima in
est distinctio qui assumenda accusamus dignissimos officia nesciunt nobisid nihil consequatur molestias animi provident, nisi error delectus possimus ut eligendi vitae
placeat eos harum cupiditate facilis reprehenderit voluptatem beatae
modi ducimus quo illum voluptas eligendi
et nobis quia fugitfuga nam accusamus voluptas reiciendis itaque, ad mollitia et omnis minus architecto odit
voluptas doloremque maxime aut non ipsa qui alias veniam
blanditiis culpa aut quia nihil cumque facere et occaecati
qui aspernatur quia eaque ut aperiam inventoreprovident vel ut sit ratione est, debitis et eaque non officia sed nesciunt pariatur vel
voluptatem iste vero et ea
numquam aut expedita ipsum nulla in
voluptates omnis consequatur aut enim officiis in quam quiexplicabo et eos deleniti nostrum ab id repellendus, animi esse sit aut sit nesciunt assumenda eum voluptas
quia voluptatibus provident quia necessitatibus ea
rerum repudiandae quia voluptatem delectus fugit aut id quia
ratione optio eos iusto veniam iureeos dolorem iste accusantium est eaque quam, corporis rerum ducimus vel eum accusantium
maxime aspernatur a porro possimus iste omnis
est in deleniti asperiores fuga aut
voluptas sapiente vel dolore minus voluptatem incidunt exenim quo cumque, ut voluptatum aliquid illo tenetur nemo sequi quo facilis
ipsum rem optio mollitia quas
voluptatem eum voluptas qui
unde omnis voluptatem iure quasi maxime voluptas namnon est facere, molestias id nostrum
excepturi molestiae dolore omnis repellendus quaerat saepe
consectetur iste quaerat tenetur asperiores accusamus ex ut
nam quidem est ducimus sunt debitis saepecommodi ullam sint et excepturi error explicabo praesentium voluptas, odio fugit voluptatum ducimus earum autem est incidunt voluptatem
odit reiciendis aliquam sunt sequi nulla dolorem
non facere repellendus voluptates quia
ratione harum vitae uteligendi iste nostrum consequuntur adipisci praesentium sit beatae perferendis, similique fugit est
illum et dolorum harum et voluptate eaque quidem
exercitationem quos nam commodi possimus cum odio nihil nulla
dolorum exercitationem magnam ex et a et distinctio debitisoptio dolor molestias sit, temporibus est consectetur dolore
et libero debitis vel velit laboriosam quia
ipsum quibusdam qui itaque fuga rem aut
ea et iure quam sed maxime ut distinctio quaeut numquam possimus omnis eius suscipit laudantium iure, est natus reiciendis nihil possimus aut provident
ex et dolor
repellat pariatur est
nobis rerum repellendus dolorem autemaut quo modi neque nostrum ducimus, voluptatem quisquam iste
voluptatibus natus officiis facilis dolorem
quis quas ipsam
vel et voluptatum in aliquidquibusdam cumque rem aut deserunt, voluptatem assumenda ut qui ut cupiditate aut impedit veniam
occaecati nemo illum voluptatem laudantium
molestiae beatae rerum ea iure soluta nostrum
eligendi et voluptateut voluptatem illum ea doloribus itaque eos, voluptates quo voluptatem facilis iure occaecati
vel assumenda rerum officia et
illum perspiciatis ab deleniti
laudantium repellat ad ut et autem reprehenderitlaborum non sunt aut ut assumenda perspiciatis voluptas, inventore ab sint
natus fugit id nulla sequi architecto nihil quaerat
eos tenetur in in eum veritatis non
quibusdam officiis aspernatur cumque aut commodi autrepellendus qui recusandae incidunt voluptates tenetur qui omnis exercitationem, error suscipit maxime adipisci consequuntur recusandae
voluptas eligendi et est et voluptates
quia distinctio ab amet quaerat molestiae et vitae
adipisci impedit sequi nesciunt quis consectetursoluta aliquam aperiam consequatur illo quis voluptas, sunt dolores aut doloribus
dolore doloribus voluptates tempora et
doloremque et quo
cum asperiores sit consectetur doloremqui enim et consequuntur quia animi quis voluptate quibusdam, iusto est quibusdam fuga quas quaerat molestias
a enim ut sit accusamus enim
temporibus iusto accusantium provident architecto
soluta esse reprehenderit qui laborumut quo aut ducimus alias, minima harum praesentium eum rerum illo dolore
quasi exercitationem rerum nam
porro quis neque quo
consequatur minus dolor quidem veritatis sunt non explicabo similiquesit asperiores ipsam eveniet odio non quia, totam corporis dignissimos
vitae dolorem ut occaecati accusamus
ex velit deserunt
et exercitationem vero incidunt corrupti mollitiasit vel voluptatem et non libero, debitis excepturi ea perferendis harum libero optio
eos accusamus cum fuga ut sapiente repudiandae
et ut incidunt omnis molestiae
nihil ut eum oditqui et at rerum necessitatibus, aut est omnis dolores
neque rerum quod ea rerum velit pariatur beatae excepturi
et provident voluptas corrupti
corporis harum reprehenderit dolores eligendised ab est est, at pariatur consequuntur earum quidem
quo est laudantium soluta voluptatem
qui ullam et est
et cum voluptas voluptatum repellat estvoluptatum itaque dolores nisi et quasi, veniam voluptatum quae adipisci id
et id quia eos ad et dolorem
aliquam quo nisi sunt eos impedit error
ad similique veniamqui commodi dolor at maiores et quis id accusantium, perspiciatis et quam ea autem temporibus non voluptatibus qui
beatae a earum officia nesciunt dolores suscipit voluptas et
animi doloribus cum rerum quas et magni
et hic ut ut commodi expedita suntconsequatur placeat omnis quisquam quia reprehenderit fugit veritatis facere, asperiores sunt ab assumenda cumque modi velit
qui esse omnis
voluptate et fuga perferendis voluptas
illo ratione amet aut et omnisvoluptatem doloribus consectetur est ut ducimus, ab nemo optio odio
delectus tenetur corporis similique nobis repellendus rerum omnis facilis
vero blanditiis debitis in nesciunt doloribus dicta dolores
magnam minus velitbeatae enim quia vel, enim aspernatur illo distinctio quae praesentium
beatae alias amet delectus qui voluptate distinctio
odit sint accusantium autem omnis
quo molestiae omnis ea eveniet optiovoluptas blanditiis repellendus animi ducimus error sapiente et suscipit, enim adipisci aspernatur nemo
numquam omnis facere dolorem dolor ex quis temporibus incidunt
ab delectus culpa quo reprehenderit blanditiis asperiores
accusantium ut quam in voluptatibus voluptas ipsam dictaet fugit quas eum in in aperiam quod, id velit blanditiis
eum ea voluptatem
molestiae sint occaecati est eos perspiciatis
incidunt a error provident eaque aut aut quiconsequatur id enim sunt et et, voluptatibus ex esse
sint explicabo est aliquid cumque adipisci fuga repellat labore
molestiae corrupti ex saepe at asperiores et perferendis
natus id esse incidunt pariaturrepudiandae ea animi iusto, officia veritatis tenetur vero qui itaque
sint non ratione
sed et ut asperiores iusto eos molestiae nostrum
veritatis quibusdam et nemo iusto saepealiquid eos sed fuga est maxime repellendus, reprehenderit id nostrum
voluptas doloremque pariatur sint et accusantium quia quod aspernatur
et fugiat amet
non sapiente et consequatur necessitatibus molestiaeodio quis facere architecto reiciendis optio, magnam molestiae perferendis quisquam
qui cum reiciendis
quaerat animi amet hic inventore
ea quia deleniti quidem saepe porro velitfugiat quod pariatur odit minima, officiis error culpa consequatur modi asperiores et
dolorum assumenda voluptas et vel qui aut vel rerum
voluptatum quisquam perspiciatis quia rerum consequatur totam quas
sequi commodi repudiandae asperiores et saepe avoluptatem laborum magni, sunt repellendus quae
est asperiores aut deleniti esse accusamus repellendus quia aut
quia dolorem unde
eum tempora esse doloreet iusto veniam et illum aut fuga, occaecati a doloribus
iste saepe consectetur placeat eum voluptate dolorem et
qui quo quia voluptas
rerum ut id enim velit est perferendissint hic doloribus consequatur eos non id, quam occaecati qui deleniti consectetur
consequatur aut facere quas exercitationem aliquam hic voluptas
neque id sunt ut aut accusamus
sunt consectetur expedita inventore velitconsequuntur deleniti eos quia temporibus ab aliquid at, voluptatem cumque tenetur consequatur expedita ipsum nemo quia explicabo
aut eum minima consequatur
tempore cumque quae est et
et in consequuntur voluptatem voluptates autenim unde ratione doloribus quas enim ut sit sapiente, odit qui et et necessitatibus sint veniam
mollitia amet doloremque molestiae commodi similique magnam et quam
blanditiis est itaque
quo et tenetur ratione occaecati molestiae temporadignissimos eum dolor ut enim et delectus in, commodi non non omnis et voluptas sit
autem aut nobis magnam et sapiente voluptatem
et laborum repellat qui delectus facilis temporibus
rerum amet et nemo voluptate expedita adipisci error doloremdoloremque officiis ad et non perferendis, ut animi facere
totam iusto tempore
molestiae eum aut et dolorem aperiam
quaerat recusandae totam odionecessitatibus quasi exercitationem odio, modi ut in nulla repudiandae dolorum nostrum eos
aut consequatur omnis
ut incidunt est omnis iste et quam
voluptates sapiente aliquam asperiores nobis amet corrupti repudiandae providentquam voluptatibus rerum veritatis, nobis facilis odit tempore cupiditate quia
assumenda doloribus rerum qui ea
illum et qui totam
aut veniam repellenduspariatur consequatur quia magnam autem omnis non amet, libero accusantium et et facere incidunt sit dolorem
non excepturi qui quia sed laudantium
quisquam molestiae ducimus est
officiis esse molestiae iste et quoslabore in ex et explicabo corporis aut quas, ex quod dolorem ea eum iure qui provident amet
quia qui facere excepturi et repudiandae
asperiores molestias provident
minus incidunt vero fugit rerum sint sunt excepturi providenttempora rem veritatis voluptas quo dolores vero, facere qui nesciunt est voluptatum voluptatem nisi
sequi eligendi necessitatibus ea at rerum itaque
harum non ratione velit laboriosam quis consequuntur
ex officiis minima doloremque voluptas ut autlaudantium voluptate suscipit sunt enim enim, ut libero sit aut totam inventore sunt
porro sint qui sunt molestiae
consequatur cupiditate qui iste ducimus adipisci
dolor enim assumenda soluta laboriosam amet iste delectus hicodit et voluptates doloribus alias odio et, est molestiae facilis quis tempora numquam nihil qui
voluptate sapiente consequatur est qui
necessitatibus autem aut ipsa aperiam modi dolore numquam
reprehenderit eius rem quibusdamoptio ipsam molestias necessitatibus occaecati facilis veritatis dolores aut, sint molestiae magni a et quos
eaque et quasi
ut rerum debitis similique veniam
recusandae dignissimos dolor incidunt consequatur odiodolore veritatis porro provident adipisci blanditiis et sunt, similique sed nisi voluptas iusto omnis
mollitia et quo
assumenda suscipit officia magnam sint sed tempora
enim provident pariatur praesentium atque animi amet rationeplaceat quia et porro iste, quasi excepturi consequatur iste autem temporibus sed molestiae beatae
et quaerat et esse ut
voluptatem occaecati et vel explicabo autem
asperiores pariatur deserunt optionostrum quis quasi placeat, eos et molestiae
nesciunt ut a
dolores perspiciatis repellendus repellat aliquid
magnam sint rem ipsum estsapiente omnis fugit eos, consequatur omnis est praesentium
ducimus non iste
neque hic deserunt
voluptatibus veniam cum et rerum sedsint soluta et vel magnam aut ut sed qui, repellat aut aperiam totam temporibus autem et
architecto magnam ut
consequatur qui cupiditate rerum quia soluta dignissimos nihil iure
tempore quas estad iusto omnis odit dolor voluptatibus, minus omnis soluta quia
qui sed adipisci voluptates illum ipsam voluptatem
eligendi officia ut in
eos soluta similique molestias praesentium blanditiisaut amet sed, libero voluptate eveniet aperiam sed
sunt placeat suscipit molestias
similique fugit nam natus
expedita consequatur consequatur dolores quia eos et placeatratione ex tenetur perferendis, aut et excepturi dicta laudantium sint rerum nihil
laudantium et at
a neque minima officia et similique libero et
commodi voluptate quibeatae soluta recusandae, dolorem quibusdam ducimus consequuntur dicta aut quo laboriosam
voluptatem quis enim recusandae ut sed sunt
nostrum est odit totam
sit error sed sunt eveniet provident qui nullaqui qui voluptates illo iste minima, aspernatur expedita soluta quo ab ut similique
expedita dolores amet
sed temporibus distinctio magnam saepe deleniti
omnis facilis nam ipsum natus sint similique omnisid minus libero illum nam ad officiis, earum voluptatem facere provident blanditiis velit laboriosam
pariatur accusamus odio saepe
cumque dolor qui a dicta ab doloribus consequatur omnis
corporis cupiditate eaque assumenda ad nesciuntquaerat velit veniam amet cupiditate aut numquam ut sequi, in non odio excepturi sint eum
labore voluptates vitae quia qui et
inventore itaque rerum
veniam non exercitationem delectus autquas fugiat ut perspiciatis vero provident, eum non blanditiis soluta porro quibusdam voluptas
vel voluptatem qui placeat dolores qui velit aut
vel inventore aut cumque culpa explicabo aliquid at
perspiciatis est et voluptatem dignissimos dolor itaque sit namlaboriosam dolor voluptates, doloremque ex facilis sit sint culpa
soluta assumenda eligendi non ut eius
sequi ducimus vel quasi
veritatis est dolorestemporibus sit alias delectus eligendi possimus magni, quo deleniti praesentium dicta non quod
aut est molestias
molestias et officia quis nihil
itaque dolorem quiaat nam consequatur ea labore ea harum, cupiditate quo est a modi nesciunt soluta
ipsa voluptas error itaque dicta in
autem qui minus magnam et distinctio eum
accusamus ratione error aut